{
  "universalExecutionMandates": [
    {
      "id": 1,
      "name": "Progressive Think",
      "description": "4-level analysis (Think → Think Hard → Think Harder → Ultra Think) MANDATORY",
      "cluster": "primary",
      "clusterName": "Core Methodology",
      "performance": {
        "current": 98.0,
        "target": 95.0,
        "trend": "up",
        "history": [
          { "timestamp": "2025-08-20T10:00:00Z", "value": 95.2 },
          { "timestamp": "2025-08-20T11:00:00Z", "value": 96.8 },
          { "timestamp": "2025-08-20T12:00:00Z", "value": 97.5 },
          { "timestamp": "2025-08-20T13:00:00Z", "value": 98.0 }
        ]
      },
      "status": "active",
      "priority": "critical"
    },
    {
      "id": 2,
      "name": "Agent Deployment",
      "description": "Deploy specialized agents FIRST - NEVER work directly",
      "cluster": "primary",
      "clusterName": "Core Methodology",
      "performance": {
        "current": 95.0,
        "target": 95.0,
        "trend": "stable",
        "history": [
          { "timestamp": "2025-08-20T10:00:00Z", "value": 94.8 },
          { "timestamp": "2025-08-20T11:00:00Z", "value": 95.2 },
          { "timestamp": "2025-08-20T12:00:00Z", "value": 94.9 },
          { "timestamp": "2025-08-20T13:00:00Z", "value": 95.0 }
        ]
      },
      "status": "active",
      "priority": "critical"
    },
    {
      "id": 3,
      "name": "TodoWrite Tracking",
      "description": "Break ALL tasks into atomic components immediately",
      "cluster": "primary",
      "clusterName": "Core Methodology",
      "performance": {
        "current": 89.0,
        "target": 95.0,
        "trend": "down",
        "history": [
          { "timestamp": "2025-08-20T10:00:00Z", "value": 92.1 },
          { "timestamp": "2025-08-20T11:00:00Z", "value": 90.8 },
          { "timestamp": "2025-08-20T12:00:00Z", "value": 89.5 },
          { "timestamp": "2025-08-20T13:00:00Z", "value": 89.0 }
        ]
      },
      "status": "partial",
      "priority": "high"
    },
    {
      "id": 4,
      "name": "Evidence Validation",
      "description": "Provide proof for ALL claims, statements, and implementations",
      "cluster": "primary",
      "clusterName": "Core Methodology",
      "performance": {
        "current": 92.0,
        "target": 95.0,
        "trend": "up",
        "history": [
          { "timestamp": "2025-08-20T10:00:00Z", "value": 90.2 },
          { "timestamp": "2025-08-20T11:00:00Z", "value": 90.8 },
          { "timestamp": "2025-08-20T12:00:00Z", "value": 91.5 },
          { "timestamp": "2025-08-20T13:00:00Z", "value": 92.0 }
        ]
      },
      "status": "partial",
      "priority": "high"
    },
    {
      "id": 5,
      "name": "Context7 Research",
      "description": "MANDATORY for ALL coding/library integration before agents",
      "cluster": "secondary",
      "clusterName": "Research & Preparation",
      "performance": {
        "current": 96.0,
        "target": 95.0,
        "trend": "up",
        "history": [
          { "timestamp": "2025-08-20T10:00:00Z", "value": 94.8 },
          { "timestamp": "2025-08-20T11:00:00Z", "value": 95.2 },
          { "timestamp": "2025-08-20T12:00:00Z", "value": 95.8 },
          { "timestamp": "2025-08-20T13:00:00Z", "value": 96.0 }
        ]
      },
      "status": "active",
      "priority": "critical"
    },
    {
      "id": 6,
      "name": "System Documentation",
      "description": "Check framework docs BEFORE improvising solutions",
      "cluster": "secondary",
      "clusterName": "Research & Preparation",
      "performance": {
        "current": 88.0,
        "target": 95.0,
        "trend": "down",
        "history": [
          { "timestamp": "2025-08-20T10:00:00Z", "value": 90.5 },
          { "timestamp": "2025-08-20T11:00:00Z", "value": 89.2 },
          { "timestamp": "2025-08-20T12:00:00Z", "value": 88.8 },
          { "timestamp": "2025-08-20T13:00:00Z", "value": 88.0 }
        ]
      },
      "status": "partial",
      "priority": "high"
    },
    {
      "id": 7,
      "name": "Quality Standards",
      "description": "Apply TDD/BDD methodology to ALL development work",
      "cluster": "secondary",
      "clusterName": "Research & Preparation",
      "performance": {
        "current": 94.0,
        "target": 95.0,
        "trend": "stable",
        "history": [
          { "timestamp": "2025-08-20T10:00:00Z", "value": 93.8 },
          { "timestamp": "2025-08-20T11:00:00Z", "value": 94.1 },
          { "timestamp": "2025-08-20T12:00:00Z", "value": 93.9 },
          { "timestamp": "2025-08-20T13:00:00Z", "value": 94.0 }
        ]
      },
      "status": "partial",
      "priority": "high"
    },
    {
      "id": 8,
      "name": "Pattern Documentation",
      "description": "Record ALL discoveries in system files immediately",
      "cluster": "secondary",
      "clusterName": "Research & Preparation",
      "performance": {
        "current": 91.0,
        "target": 95.0,
        "trend": "up",
        "history": [
          { "timestamp": "2025-08-20T10:00:00Z", "value": 89.5 },
          { "timestamp": "2025-08-20T11:00:00Z", "value": 90.2 },
          { "timestamp": "2025-08-20T12:00:00Z", "value": 90.8 },
          { "timestamp": "2025-08-20T13:00:00Z", "value": 91.0 }
        ]
      },
      "status": "partial",
      "priority": "medium"
    },
    {
      "id": 9,
      "name": "Git Integration",
      "description": "Auto-commit + push for ALL changes",
      "cluster": "tertiary",
      "clusterName": "Workflow Automation",
      "performance": {
        "current": 97.0,
        "target": 95.0,
        "trend": "stable",
        "history": [
          { "timestamp": "2025-08-20T10:00:00Z", "value": 96.8 },
          { "timestamp": "2025-08-20T11:00:00Z", "value": 97.2 },
          { "timestamp": "2025-08-20T12:00:00Z", "value": 96.9 },
          { "timestamp": "2025-08-20T13:00:00Z", "value": 97.0 }
        ]
      },
      "status": "active",
      "priority": "medium"
    },
    {
      "id": 10,
      "name": "Parallel Execution",
      "description": "Multiple agents concurrently (MAX 10 per message)",
      "cluster": "tertiary",
      "clusterName": "Workflow Automation",
      "performance": {
        "current": 85.0,
        "target": 95.0,
        "trend": "down",
        "history": [
          { "timestamp": "2025-08-20T10:00:00Z", "value": 88.2 },
          { "timestamp": "2025-08-20T11:00:00Z", "value": 86.8 },
          { "timestamp": "2025-08-20T12:00:00Z", "value": 85.9 },
          { "timestamp": "2025-08-20T13:00:00Z", "value": 85.0 }
        ]
      },
      "status": "partial",
      "priority": "high"
    },
    {
      "id": 11,
      "name": "Session Management",
      "description": "RECENTER workflow active for ALL requests",
      "cluster": "tertiary",
      "clusterName": "Workflow Automation",
      "performance": {
        "current": 93.0,
        "target": 95.0,
        "trend": "up",
        "history": [
          { "timestamp": "2025-08-20T10:00:00Z", "value": 91.8 },
          { "timestamp": "2025-08-20T11:00:00Z", "value": 92.2 },
          { "timestamp": "2025-08-20T12:00:00Z", "value": 92.8 },
          { "timestamp": "2025-08-20T13:00:00Z", "value": 93.0 }
        ]
      },
      "status": "partial",
      "priority": "medium"
    },
    {
      "id": 12,
      "name": "Framework Updates",
      "description": "Document corrections in CLAUDE.md immediately",
      "cluster": "tertiary",
      "clusterName": "Workflow Automation",
      "performance": {
        "current": 90.0,
        "target": 95.0,
        "trend": "stable",
        "history": [
          { "timestamp": "2025-08-20T10:00:00Z", "value": 89.8 },
          { "timestamp": "2025-08-20T11:00:00Z", "value": 90.2 },
          { "timestamp": "2025-08-20T12:00:00Z", "value": 89.9 },
          { "timestamp": "2025-08-20T13:00:00Z", "value": 90.0 }
        ]
      },
      "status": "partial",
      "priority": "medium"
    },
    {
      "id": 13,
      "name": "Personality Orchestration",
      "description": "Auto-optimal personality adaptation for ALL interactions",
      "cluster": "quaternary",
      "clusterName": "Intelligence Amplification",
      "performance": {
        "current": 96.0,
        "target": 95.0,
        "trend": "up",
        "history": [
          { "timestamp": "2025-08-20T10:00:00Z", "value": 94.5 },
          { "timestamp": "2025-08-20T11:00:00Z", "value": 95.2 },
          { "timestamp": "2025-08-20T12:00:00Z", "value": 95.8 },
          { "timestamp": "2025-08-20T13:00:00Z", "value": 96.0 }
        ]
      },
      "status": "active",
      "priority": "medium"
    },
    {
      "id": 14,
      "name": "Knowledge Integration",
      "description": "Auto-load relevant framework knowledge for ALL sessions",
      "cluster": "quaternary",
      "clusterName": "Intelligence Amplification",
      "performance": {
        "current": 89.0,
        "target": 95.0,
        "trend": "down",
        "history": [
          { "timestamp": "2025-08-20T10:00:00Z", "value": 91.2 },
          { "timestamp": "2025-08-20T11:00:00Z", "value": 90.5 },
          { "timestamp": "2025-08-20T12:00:00Z", "value": 89.8 },
          { "timestamp": "2025-08-20T13:00:00Z", "value": 89.0 }
        ]
      },
      "status": "partial",
      "priority": "high"
    },
    {
      "id": 15,
      "name": "Quality Assurance",
      "description": "Maximum excellence standards for ALL requests",
      "cluster": "quaternary",
      "clusterName": "Intelligence Amplification",
      "performance": {
        "current": 95.0,
        "target": 95.0,
        "trend": "stable",
        "history": [
          { "timestamp": "2025-08-20T10:00:00Z", "value": 94.8 },
          { "timestamp": "2025-08-20T11:00:00Z", "value": 95.1 },
          { "timestamp": "2025-08-20T12:00:00Z", "value": 94.9 },
          { "timestamp": "2025-08-20T13:00:00Z", "value": 95.0 }